{
  "opendb_id": "40b5fe6e-4cd7-40a8-bc7d-7ac2646ba433",
  "connectivity_type": [],
  "lighting": [],
  "metadata": {
    "name": "Logitech C310 Webcam",
    "manufacturer": "Logitech",
    "part_numbers": ["960-000585"]
  },
  "general_product_information": {},
  "identifiers": {
    "version": 1,
    "identifiers": [
      {
        "type": "ean",
        "value": "0012300070041",
        "region": "all"
      },
      {
        "type": "mpn",
        "value": "960_000585",
        "region": "all"
      },
      {
        "type": "mpn",
        "value": "960-000585",
        "region": "all"
      },
      {
        "type": "upc",
        "value": "809385671504",
        "region": "all"
      }
    ],
    "retailer_listings": [
      {
        "source": "amazon",
        "channel": "au",
        "source_product_id": "B003LVZO8S",
        "pricing_enabled": true,
        "verified": true
      },
      {
        "source": "amazon",
        "channel": "be",
        "source_product_id": "B003LVZO8S",
        "pricing_enabled": true,
        "verified": true
      },
      {
        "source": "amazon",
        "channel": "ca",
        "source_product_id": "B003LVZO8S",
        "pricing_enabled": true,
        "verified": true
      },
      {
        "source": "amazon",
        "channel": "de",
        "source_product_id": "B003LVZO8S",
        "pricing_enabled": true,
        "verified": true
      },
      {
        "source": "amazon",
        "channel": "es",
        "source_product_id": "B003LVZO8S",
        "pricing_enabled": true,
        "verified": true
      },
      {
        "source": "amazon",
        "channel": "fr",
        "source_product_id": "B003LVZO8S",
        "pricing_enabled": true,
        "verified": true
      },
      {
        "source": "amazon",
        "channel": "ie",
        "source_product_id": "B003LVZO8S",
        "pricing_enabled": true,
        "verified": true
      },
      {
        "source": "amazon",
        "channel": "it",
        "source_product_id": "B003LVZO8S",
        "pricing_enabled": true,
        "verified": true
      },
      {
        "source": "amazon",
        "channel": "jp",
        "source_product_id": "B003LVZO8S",
        "pricing_enabled": true,
        "verified": true
      },
      {
        "source": "amazon",
        "channel": "nl",
        "source_product_id": "B003LVZO8S",
        "pricing_enabled": true,
        "verified": true
      },
      {
        "source": "amazon",
        "channel": "pl",
        "source_product_id": "B003LVZO8S",
        "pricing_enabled": true,
        "verified": true
      },
      {
        "source": "amazon",
        "channel": "se",
        "source_product_id": "B003LVZO8S",
        "pricing_enabled": true,
        "verified": true
      },
      {
        "source": "amazon",
        "channel": "sg",
        "source_product_id": "B003LVZO8S",
        "pricing_enabled": true,
        "verified": true
      },
      {
        "source": "amazon",
        "channel": "uk",
        "source_product_id": "B003LVZO8S",
        "pricing_enabled": true,
        "verified": true
      },
      {
        "source": "amazon",
        "channel": "us",
        "source_product_id": "B003LVZO8S",
        "pricing_enabled": true,
        "verified": true
      },
      {
        "source": "newegg",
        "channel": "ca",
        "source_product_id": "9SIA17PKDN9893",
        "pricing_enabled": true,
        "verified": false
      },
      {
        "source": "newegg",
        "channel": "us",
        "source_product_id": "9SIA17PKDN9893",
        "pricing_enabled": true,
        "verified": false
      },
      {
        "source": "walmart",
        "channel": "us",
        "source_product_id": "171491783",
        "pricing_enabled": true,
        "verified": false
      }
    ]
  }
}
