{
  "opendb_id": "e3813e85-19d6-47d1-a89c-d8b50fc41901",
  "connectivity_type": [],
  "lighting": [],
  "metadata": {
    "name": "Logitech B525 1080p 720p Webcam",
    "manufacturer": "Logitech",
    "part_numbers": ["960-000841", "960-000842", "2227883"]
  },
  "general_product_information": {},
  "identifiers": {
    "version": 1,
    "identifiers": [
      {
        "type": "ean",
        "value": "0722868808412",
        "region": "all"
      },
      {
        "type": "mpn",
        "value": "2227883",
        "region": "all"
      },
      {
        "type": "mpn",
        "value": "960-000841",
        "region": "all"
      },
      {
        "type": "mpn",
        "value": "960-000842",
        "region": "all"
      },
      {
        "type": "upc",
        "value": "722868808412",
        "region": "all"
      }
    ],
    "retailer_listings": [
      {
        "source": "amazon",
        "channel": "au",
        "source_product_id": "B005IX10FS",
        "pricing_enabled": true,
        "verified": true
      },
      {
        "source": "amazon",
        "channel": "be",
        "source_product_id": "B005IX10FS",
        "pricing_enabled": true,
        "verified": true
      },
      {
        "source": "amazon",
        "channel": "ca",
        "source_product_id": "B005IX10FS",
        "pricing_enabled": true,
        "verified": true
      },
      {
        "source": "amazon",
        "channel": "de",
        "source_product_id": "B005IX10FS",
        "pricing_enabled": true,
        "verified": true
      },
      {
        "source": "amazon",
        "channel": "es",
        "source_product_id": "B005IX10FS",
        "pricing_enabled": true,
        "verified": true
      },
      {
        "source": "amazon",
        "channel": "fr",
        "source_product_id": "B005IX10FS",
        "pricing_enabled": true,
        "verified": true
      },
      {
        "source": "amazon",
        "channel": "ie",
        "source_product_id": "B005IX10FS",
        "pricing_enabled": true,
        "verified": true
      },
      {
        "source": "amazon",
        "channel": "it",
        "source_product_id": "B005IX10FS",
        "pricing_enabled": true,
        "verified": true
      },
      {
        "source": "amazon",
        "channel": "jp",
        "source_product_id": "B005IX10FS",
        "pricing_enabled": true,
        "verified": true
      },
      {
        "source": "amazon",
        "channel": "nl",
        "source_product_id": "B005IX10FS",
        "pricing_enabled": true,
        "verified": true
      },
      {
        "source": "amazon",
        "channel": "pl",
        "source_product_id": "B005IX10FS",
        "pricing_enabled": true,
        "verified": true
      },
      {
        "source": "amazon",
        "channel": "se",
        "source_product_id": "B005IX10FS",
        "pricing_enabled": true,
        "verified": true
      },
      {
        "source": "amazon",
        "channel": "sg",
        "source_product_id": "B005IX10FS",
        "pricing_enabled": true,
        "verified": true
      },
      {
        "source": "amazon",
        "channel": "uk",
        "source_product_id": "B005IX10FS",
        "pricing_enabled": true,
        "verified": true
      },
      {
        "source": "amazon",
        "channel": "us",
        "source_product_id": "B005IX10FS",
        "pricing_enabled": true,
        "verified": true
      },
      {
        "source": "cenowarka",
        "channel": "pl",
        "source_product_id": "675800",
        "pricing_enabled": true,
        "verified": false
      },
      {
        "source": "geizhals",
        "channel": "de",
        "source_product_id": "675800",
        "pricing_enabled": true,
        "verified": false
      },
      {
        "source": "skinflint",
        "channel": "uk",
        "source_product_id": "675800",
        "pricing_enabled": true,
        "verified": false
      },
      {
        "source": "walmart",
        "channel": "us",
        "source_product_id": "259662075",
        "pricing_enabled": true,
        "verified": false
      }
    ]
  }
}
